{
  "schema_version": "1.0",
  "id": "contradictory-northstar-nook",
  "title": "Northstar Nook Coworking",
  "summary": "Marketing says 98% of studios remain open, but the disclosed outlet table implies 15% closed during the measured period.",
  "category": "contradictory",
  "flagship": false,
  "input": {"buyer_name": "Theo", "maximum_investment": 205000, "emergency_reserve": 45000, "required_monthly_household_income": 5000, "preferred_location": "Pine District", "risk_tolerance": "moderate", "currency": "USD", "cash_available": 260000},
  "documents": [
    {"document_id": "northstar-brochure", "title": "Northstar Nook Growth Story", "kind": "brochure", "path": "documents/brochure.md"},
    {"document_id": "northstar-disclosure", "title": "Northstar Nook Synthetic Disclosure", "kind": "disclosure", "path": "documents/disclosure.md"},
    {"document_id": "northstar-lease", "title": "Pine District Lease Abstract", "kind": "lease", "path": "documents/lease.md"}
  ],
  "location_data": {"latitude": 44.944, "longitude": -93.177, "market_area_sq_miles": 12, "population": 57000, "competitors": [{"name": "Desk Pine", "distance_miles": 1.8}, {"name": "Work Wharf", "distance_miles": 4.9}]},
  "finance_inputs": {"franchise_fee": 38000, "buildout": 72000, "equipment": 42000, "opening_inventory": 9000, "other_opening_costs": 19000, "monthly_revenue": 65000, "cogs_rate": 0.25, "royalty_rate": 0.06, "marketing_rate": 0.025, "technology_rate": 0.005, "technology_fixed": 250, "rent": 7000, "payroll": 22000, "utilities": 1200, "insurance": 650, "other_fixed": 2500}
}
